{
  "assessment_id": "JCA-A-004",
  "lesson_ids": ["JCA-M08-L02"],
  "lesson_pair_reason": "NOT_APPLICABLE",
  "assessment_type": "INTEGRATED_TASK",
  "purpose": "验证多个已教知识能否被组合使用而仍不越出 Lesson scope：学生要独立完成一次完整图片创作并交付，同时说明提示词组织依据与调整理由。",
  "target_outcomes": [
    "按流程完成一次图片生成并下载结果",
    "输入与创作意图相符的图片提示词"
  ],
  "knowledge_refs": ["JIM-K-0051", "JIM-K-0052", "JIM-K-0053", "JIM-K-0049"],
  "scope": "该官方产品页所述图片生成流程与 2026-10-04 观察到的 Jimeng Web 图片生成界面；不含「画布」完整能力、调整功能参数与结果质量评价。",
  "task": "不看步骤清单，独立完成一次图片创作并交付：①写出一句本次创作目标；②写出一条以对象为起点、由短句组成的图片提示词；③完成触发生成并查看结果；④完成一次下载交付。交付时附三段说明：你的创作目标；你的提示词为什么以那个对象为起点；如果你要调整一次，你会选择修复、展开还是删除，依据是什么。",
  "expected_evidence": "①书面创作目标；②写出的提示词（可见对象起点与短句组织）；③下载产物；④三段说明文本。",
  "scoring_criteria": [
    {
      "criterion_id": "A004-C1",
      "description": "写出本次创作目标",
      "evidence_source": "书面目标",
      "weight": 2,
      "pass_condition": "目标可判断，且与最终交付物一致"
    },
    {
      "criterion_id": "A004-C2",
      "description": "提示词以对象为起点并使用短句",
      "evidence_source": "写出的提示词",
      "weight": 2,
      "pass_condition": "首项为创作对象而非形容词；整体由短句构成"
    },
    {
      "criterion_id": "A004-C3",
      "description": "完成触发生成并查看结果",
      "evidence_source": "屏幕记录或结果预览",
      "weight": 2,
      "pass_condition": "存在一次实际生成的结果并被查看"
    },
    {
      "criterion_id": "A004-C4",
      "description": "完成一次下载交付",
      "evidence_source": "下载产物",
      "weight": 2,
      "pass_condition": "存在一次实际下载得到的文件"
    },
    {
      "criterion_id": "A004-C5",
      "description": "说明提示词的组织依据与所选调整动作的理由",
      "evidence_source": "三段说明文本",
      "weight": 2,
      "pass_condition": "说明指向已教依据（对象先行与短句），且调整动作选择给出理由；不要求结果本身好看"
    }
  ],
  "max_score": 10,
  "pass_score": 8,
  "partial_credit_policy": "允许 partial credit：每条 criterion 按 0 / 1 / 2 计分。说明类 criterion 若依据方向正确但只能部分说清，得 1。**不因结果美观程度或效果好坏扣分**——本 assessment 只评分是否按已教流程与方法完成、以及是否能说明依据。",
  "allowed_support": ["lesson notes", "course outline", "product UI"],
  "disallowed_support": ["external web search", "unverified community tutorial", "another person's completed answer"],
  "feedback_boundary": "评分后只可告知：哪条 criterion 未达标、对应 Lesson（JCA-M08-L02）、以及「建议值不是规格」「调整功能存在性不被假定」这类 boundary 提醒。不得对作品美学给出评分性意见，不得推断长期掌握程度。",
  "alignment": {
    "completion_check_alignment": "DIRECT",
    "rationale": "JCA-M08-L02 的 completion_check 是「能独立完成一次完整的图片创作（目标 → 提示词 → 触发 → 查看 → 下载），并能说明其提示词的组织依据与所选调整动作的理由」。C1 ～ C4 对应流程五段，C5 对应说明部分。"
  },
  "limitations": "只覆盖该产品页所述流程与该时点界面；不评分结果质量与美观；不涉及「画布」完整能力、素材规格、账号权限；一次评估不代表长期掌握。",
  "status": "pilot"
}
