{
  "assessment_id": "JCA-A-003",
  "lesson_ids": ["JCA-M07-L02"],
  "lesson_pair_reason": "NOT_APPLICABLE",
  "assessment_type": "APPLY_RULE",
  "purpose": "验证 heavy-but-cohesive Module 中的规则学习能被独立评分：学生要面对三种对已生成内容的处理方式，应用第 4.2 节的规则作出判断并说明依据。",
  "target_outcomes": [
    "解释平台对 AI 内容添加标识的依据",
    "解释不得遮挡、涂抹、修改或删除平台添加标识的要求"
  ],
  "knowledge_refs": ["JIM-K-0027", "JIM-K-0028"],
  "scope": "平台规则限 P14 所保存第 4.2 节中关于 AI 内容标识的成对命题；不含标识的具体形式、位置与技术实现。",
  "task": "对下列三种对已生成内容的处理方式，逐条判断「触碰第 4.2 节禁止性要求」或「不触碰」，并写出判断依据：①下载后把画面角落的标识区域裁掉再发布；②用修图工具把标识涂掉后重新上传；③原样发布、不做任何处理。另外写出两句：标识由谁添加、依据什么；「平台有权添加标识」与「平台一定会添加标识」有什么区别。",
  "expected_evidence": "①三条判断（①②触碰、③不触碰）及逐条依据；②一句说明添加主体是平台、依据是法律法规与强制性国家标准；③一句说明「有权添加」是权利，「一定添加」是承诺，本课证据不支持后者。",
  "scoring_criteria": [
    {
      "criterion_id": "A003-C1",
      "description": "判定「裁掉标识区域再发布」触碰禁止性要求",
      "evidence_source": "判断结果与依据",
      "weight": 2,
      "pass_condition": "结论为触碰，且依据指向「不得遮挡或修改平台添加的标识」"
    },
    {
      "criterion_id": "A003-C2",
      "description": "判定「涂掉标识后重新上传」触碰禁止性要求",
      "evidence_source": "判断结果与依据",
      "weight": 2,
      "pass_condition": "结论为触碰，且依据指向「不得涂抹或删除平台添加的标识」"
    },
    {
      "criterion_id": "A003-C3",
      "description": "判定「原样发布」不触碰禁止性要求",
      "evidence_source": "判断结果与依据",
      "weight": 2,
      "pass_condition": "结论为不触碰，且未把「未做处理」误判为「未添加标识」"
    },
    {
      "criterion_id": "A003-C4",
      "description": "说明标识的添加主体与依据",
      "evidence_source": "手写说明",
      "weight": 2,
      "pass_condition": "指出添加主体是平台、依据是法律法规与强制性国家标准、方式是「适当方式」"
    },
    {
      "criterion_id": "A003-C5",
      "description": "区分「有权添加」与「一定添加」",
      "evidence_source": "手写说明",
      "weight": 2,
      "pass_condition": "明确指出前者是权利、后者是承诺，且本课证据不支持「一定添加」"
    }
  ],
  "max_score": 10,
  "pass_score": 8,
  "partial_credit_policy": "允许 partial credit：每条判断类 criterion 按 0 / 1 / 2 计分——结论正确但依据空泛得 1，结论与依据都正确得 2。说明类 criterion 若抓住要点但表述不完整得 1。不因用词与条款原文不同而扣分。",
  "allowed_support": ["lesson notes", "course outline"],
  "disallowed_support": ["external web search", "unverified community tutorial", "another person's completed answer"],
  "feedback_boundary": "评分后只可告知：哪条 criterion 未达标、对应 Lesson（JCA-M07-L02）、以及「范围描述不是禁止性规定 / 未验证不等于不支持」这一 boundary 提醒。不得补充条款子项、不得给出标识形式或技术实现。",
  "alignment": {
    "completion_check_alignment": "DIRECT",
    "rationale": "JCA-M07-L02 的 completion_check 是「能解释标识的添加依据与不得破坏标识的要求，并正确判断给定的三种处理方式」。C1/C2/C3 对应「正确判断三种处理方式」，C4/C5 对应「解释添加依据与不得破坏的要求」。"
  },
  "limitations": "只覆盖 P14 第 4.2 节所选命题；不判断具体标识形式与技术实现、不表示平台一定添加标识；不构成法律意见；一次评估不代表长期掌握。",
  "status": "full_course"
}
