{
  "assessment_id": "JCA-A-020",
  "lesson_ids": ["JCA-M07-L04"],
  "lesson_pair_reason": "NOT_APPLICABLE",
  "assessment_type": "APPLY_RULE",
  "purpose": "测量 JCA-M07-L04 的两条 outcome：学生要说明平台处理条款的组引用范围与处理上下文，并把真实身份认证前提对应到实际生成动作。",
  "target_outcomes": ["解释平台处理条款所引用的规则集合范围与处理上下文", "解释真实身份认证前提限定基础生成工作流中的实际生成动作"],
  "knowledge_refs": ["JIM-K-0029", "JIM-K-0035", "JIM-K-0009", "JIM-K-0010", "JIM-K-0046"],
  "scope": "平台规则限 P14 第 4.8 节与第 4.3 节；准入结构限 P14 §4.3 与 P10 第三步的对照范围，即真实身份认证前提对视频生成流程中实际生成动作的约束。",
  "task": "对一次计划中的视频生成，依次回答三个问题：①该创作涉及哪一条准入前提？②该前提约束流程中的哪一步、不约束哪一步？③如果行为被认定为违反或可能违反「上述约定」，处理条款覆盖的范围是什么？然后改写两句话并说明理由：把「违反规则就会被封号」改写成符合证据的表述。",
  "expected_evidence": "①指出涉及真实身份信息认证这一准入前提；②指出它约束的是第三步中的实际生成动作，不约束进入工具与查看下载；③说明处理条款引用的是「上述约定」这一规则集合、描述的是处理上下文；④两句改写，把后果表述为处理上下文而非必然处罚。",
  "scoring_criteria": [
    {"criterion_id": "A020-C1", "description": "指出涉及的准入前提", "evidence_source": "书面回答", "weight": 2, "pass_condition": "指出为真实身份信息认证前提"},
    {"criterion_id": "A020-C2", "description": "指出前提约束的流程步骤", "evidence_source": "书面回答", "weight": 2, "pass_condition": "指出它约束第三步中的实际生成动作，不约束进入工具与查看下载"},
    {"criterion_id": "A020-C3", "description": "说明处理条款的组引用范围", "evidence_source": "书面回答", "weight": 2, "pass_condition": "指出它引用的是「上述约定」这一规则集合，不是某一条具体规则"},
    {"criterion_id": "A020-C4", "description": "把后果表述为处理上下文", "evidence_source": "改写文本", "weight": 2, "pass_condition": "改写后不再表述为必然处罚或自动处罚"},
    {"criterion_id": "A020-C5", "description": "不推断未验证内容", "evidence_source": "整体作答", "weight": 2, "pass_condition": "未推断认证界面、执行时机、账号权限，也未把该约束扩展为整条流程的前提"}
  ],
  "max_score": 10,
  "pass_score": 8,
  "partial_credit_policy": "允许 partial credit：每条 0/1/2。三问中答对两问得 1；改写正确但理由空泛得 1。不因用词与条款原文不同扣分。",
  "allowed_support": ["lesson notes", "course outline"],
  "disallowed_support": ["external web search", "unverified community tutorial", "another person's completed answer"],
  "feedback_boundary": "评分后只可告知：哪条 criterion 未达标、对应 Lesson（JCA-M07-L04）、以及「处理上下文 ≠ 必然处罚」「认证前提只约束实际生成动作」两条 boundary 提醒。不得推断认证界面、执行时机或账号权限。",
  "alignment": {
    "completion_check_alignment": "DIRECT",
    "rationale": "JCA-M07-L04 的 completion_check 是「能把真实身份认证前提对应到视频生成流程中的实际生成动作，并说明处理条款的组引用范围；同时能把『后果』表述为处理上下文而不是必然处罚」。C1/C2 对应前半，C3/C4/C5 对应后半与其边界。"
  },
  "limitations": "只覆盖 P14 第 4.8 节与第 4.3 节，以及 P10 产品页第三步的对照范围；该对照关系为推得关系，不是条款原句；不推断认证界面、执行时机、账号权限或现行法律；不覆盖《社区自律公约》、阈值与后续版本变化；一次评估不代表长期掌握。",
  "status": "full_course"
}
