{
  "assessment_id": "JCA-A-005",
  "lesson_ids": [
    "JCA-M01-L01"
  ],
  "lesson_pair_reason": "NOT_APPLICABLE",
  "assessment_type": "CLASSIFY",
  "purpose": "测量 JCA-M01-L01 的三条 outcome：学生要把一组同主题声明正确归入产品层、模型层或版本记录，并为每层写出一句「不能推出什么」。",
  "target_outcomes": [
    "区分同主题下的产品层声明与模型层声明",
    "解释版本记录只说明已保存的历史事实，不证明当前可用性",
    "识别“模型具备该能力”不等于“该账号已开放该功能”"
  ],
  "knowledge_refs": [
    "JIM-K-0001",
    "JIM-K-0014",
    "JIM-K-0036",
    "JIM-K-0038",
    "JIM-K-0042",
    "JIM-K-0043"
  ],
  "scope": "Jimeng Product Layer 与 ByteDance Seed Model Layer 的声明分层；版本记录限官方页面已保存的发布事实与上线声明。不含产品操作步骤与完整模型菜单。",
  "task": "给出四句同主题声明，逐句标注它属于「模型层声明」「发布事实」「上线声明」还是「产品层说明」，并为每句写出一句「这句话不能推出什么」：①某模型官方说明支持某类生成方式；②官方发布页记载某版本于某日发布；③官方发布页记载某版本已上线某产品；④该产品的某功能可以生成带声音的视频。最后另写一句：为什么「模型具备某能力」不能推出「该账号已开放该功能」。",
  "expected_evidence": "①四句的层次标注结果；②每句一条「不能推出」的结论；③一句说明「模型具备 ≠ 账号已开放」的理由陈述。",
  "scoring_criteria": [
    {
      "criterion_id": "A005-C1",
      "description": "区分产品层声明与模型层声明",
      "evidence_source": "层次标注结果",
      "weight": 2,
      "pass_condition": "①属模型层声明，②属发布事实，③属上线声明，④属产品层说明；其中②③为版本记录的两类。"
    },
    {
      "criterion_id": "A005-C2",
      "description": "为每句写出一条「不能推出」的结论",
      "evidence_source": "手写结论",
      "weight": 2,
      "pass_condition": "四条结论均指向该句自身的范围限制，未跨层推断"
    },
    {
      "criterion_id": "A005-C3",
      "description": "解释版本记录只说明历史事实、不证明当前可用",
      "evidence_source": "手写结论",
      "weight": 2,
      "pass_condition": "明确指出发布日期/上线声明不能推出「当前仍开放」或「所有账号可用」"
    },
    {
      "criterion_id": "A005-C4",
      "description": "说明「模型具备」不等于「账号已开放」",
      "evidence_source": "手写理由",
      "weight": 2,
      "pass_condition": "指出模型层能力声明的范围说明为「不代表即梦产品已部署或开放」"
    },
    {
      "criterion_id": "A005-C5",
      "description": "标注与结论之间不出现跨层互推",
      "evidence_source": "整体作答",
      "weight": 2,
      "pass_condition": "没有任何一条结论用模型层声明证明产品可用，或用产品说明证明模型能力"
    }
  ],
  "max_score": 10,
  "pass_score": 8,
  "partial_credit_policy": "允许 partial credit：标注类 criterion 按 0/1/2 计分——错 1 句得 1，错 2 句及以上得 0；结论类 criterion 若方向正确但未说明依据得 1。不因用词与参考答案不同扣分。",
  "allowed_support": [
    "lesson notes",
    "course outline"
  ],
  "disallowed_support": [
    "external web search",
    "unverified community tutorial",
    "another person's completed answer"
  ],
  "feedback_boundary": "评分后只可告知：哪条 criterion 未达标、对应 Lesson（JCA-M01-L01）、以及「模型具备 ≠ 已发布 ≠ 已上线 ≠ 账号已开放」这一 boundary 提醒。不得补充 Registry 之外的模型清单或账号状态。",
  "alignment": {
    "completion_check_alignment": "DIRECT",
    "rationale": "JCA-M01-L01 的 completion_check 是「能对给定声明完成层次标注，并为每层至少写出一条『不能推出』的结论，包括明确说出『模型具备该能力不等于该账号已开放』」。C1 对应层次标注，C2/C3 对应「不能推出」，C4/C5 对应最后那半句。"
  },
  "limitations": "只覆盖仓库已保存的官方声明与发布页记载；不提供完整模型菜单、不判断任何账号的实际开放状态；不评分具体模型能力细节；一次评估不代表长期掌握。",
  "status": "full_course"
}
