{
  "assessment_id": "JCA-A-011",
  "lesson_ids": ["JCA-M04-L02"],
  "lesson_pair_reason": "NOT_APPLICABLE",
  "assessment_type": "PERFORM_PROCEDURE",
  "purpose": "测量 JCA-M04-L02 的两条 outcome：学生要按官方建议组织一条视频提示词，并在主体表达不清楚时完成一次修订。",
  "target_outcomes": ["输入按官方建议组织的视频提示词", "在主体表达不清楚时补充描述并完成一次修订"],
  "knowledge_refs": ["JIM-K-0047", "JIM-K-0048"],
  "scope": "Jimeng Product Layer；官方视频生成器 FAQ 的基础表达建议（组织方法与主体不清时的补足）。",
  "task": "写出两条视频提示词：第一条按官方建议用主体、场景、动作、运镜和光线组织；第二条是在第一条出现主体不清楚时的修订版本，修订方式为补足主体的外观和位置。然后说明这两条建议的适用边界。",
  "expected_evidence": "①第一条提示词中五个组织要素均可见；②第二条提示词中补足了主体的外观与位置；③一句说明该建议未给出适用模型或版本、不是效果结论、不保证一次成功。",
  "scoring_criteria": [
    {"criterion_id": "A011-C1", "description": "按五要素组织出视频提示词", "evidence_source": "写出的提示词", "weight": 2, "pass_condition": "主体、场景、动作、运镜、光线五项在提示词中均可辨认"},
    {"criterion_id": "A011-C2", "description": "完成一次主体不清楚的修订", "evidence_source": "修订后的提示词", "weight": 2, "pass_condition": "修订以补足主体外观与位置的方式作出，而非整句重写"},
    {"criterion_id": "A011-C3", "description": "说明建议的适用边界", "evidence_source": "手写说明", "weight": 2, "pass_condition": "指出未给出适用模型或版本、不是效果结论、不保证一次成功"},
    {"criterion_id": "A011-C4", "description": "不把建议写成承诺或公式", "evidence_source": "整体作答", "weight": 2, "pass_condition": "没有任何一处把五要素写成固定顺序或必填公式，也没有效果保证"},
    {"criterion_id": "A011-C5", "description": "修订可辨认", "evidence_source": "两版提示词对照", "weight": 2, "pass_condition": "两版之间的差异可被指出，且差异仅在主体描述部分"}
  ],
  "max_score": 10,
  "pass_score": 8,
  "partial_credit_policy": "允许 partial credit：每条 0/1/2。五要素漏一项得 1、漏两项及以上得 0；修订方向正确但未说明补足内容得 1。不因用词与官方建议不同扣分。",
  "allowed_support": ["lesson notes", "course outline"],
  "disallowed_support": ["external web search", "unverified community tutorial", "another person's completed answer"],
  "feedback_boundary": "评分后只可告知：哪条 criterion 未达标、对应 Lesson（JCA-M04-L02）、以及「官方建议 ≠ 效果承诺」这一 boundary 提醒。不得补充字数、语法或完整 Prompt 技法。",
  "alignment": {
    "completion_check_alignment": "DIRECT",
    "rationale": "JCA-M04-L02 的 completion_check 是「能写出按主体、场景、动作、运镜、光线组织的视频提示词，并能对主体不清楚的描述完成一次补足外观与位置的修订」。C1/C5 对应前半，C2 对应后半，C3/C4 对应该课的边界要求。"
  },
  "limitations": "只覆盖 2026-10-04 读取的官方 FAQ 基础建议；未给出适用模型或版本；不是效果结论、不保证一次成功；不含教学示例原文、完整 Prompt 技法、UI 操作或输入参数；一次评估不代表长期掌握。",
  "status": "full_course"
}
