{
  "assessment_id": "JCA-A-022",
  "lesson_ids": ["JCA-M08-L03"],
  "lesson_pair_reason": "NOT_APPLICABLE",
  "assessment_type": "INTEGRATED_TASK",
  "purpose": "测量 JCA-M08-L03 的三条 outcome：学生要独立完成一次视频创作、按已教方法组织提示词，并按已证实路径加入一次参考素材或 @ 引用。",
  "target_outcomes": ["按流程完成一次视频生成并下载产物", "输入与创作意图相符的视频提示词", "按已证实路径加入一次参考素材或 @ 引用"],
  "knowledge_refs": ["JIM-K-0009", "JIM-K-0010", "JIM-K-0011", "JIM-K-0046", "JIM-K-0047", "JIM-K-0057"],
  "scope": "即梦 Seedance 2.5 产品页所述视频流程与 2026-10-04 观察到的视频生成 / 全能参考界面；本课为独立完成，不再提供分步提示。",
  "task": "不看步骤清单，独立完成一次视频创作：①写出视频创作目标；②按主体、场景、动作、运镜和光线组织一条视频提示词；③按已证实路径加入一次参考素材或 @ 引用；④走完三步流程触发生成；⑤下载产物。最后写下三段说明：你的提示词如何覆盖五项组织要素；你加的参考素材属于哪类用途；你在哪一步曾犹豫、为什么。",
  "expected_evidence": "①书面创作目标；②写出的视频提示词（五项组织要素可辨认）；③一次参考素材加入或 @ 引用记录；④一次生成结果与一次下载产物；⑤三段说明文本。",
  "scoring_criteria": [
    {"criterion_id": "A022-C1", "description": "写出视频创作目标", "evidence_source": "书面目标", "weight": 2, "pass_condition": "目标可判断，且与最终交付物一致"},
    {"criterion_id": "A022-C2", "description": "按五要素组织视频提示词", "evidence_source": "写出的提示词", "weight": 2, "pass_condition": "主体、场景、动作、运镜、光线五项均可辨认"},
    {"criterion_id": "A022-C3", "description": "完成触发生成与下载", "evidence_source": "结果与下载产物", "weight": 2, "pass_condition": "存在一次生成结果与一次实际下载得到的文件"},
    {"criterion_id": "A022-C4", "description": "按已证实路径加入参考素材", "evidence_source": "操作记录", "weight": 2, "pass_condition": "通过全能参考的参考内容路径完成一次加入，或在输入中完成一次 @ 引用"},
    {"criterion_id": "A022-C5", "description": "说明参考素材用途与提示词依据", "evidence_source": "三段说明文本", "weight": 2, "pass_condition": "说明指向已教依据（五要素组织、参考素材用于传达动态细节），且未把官方建议写成效果保证"}
  ],
  "max_score": 10,
  "pass_score": 8,
  "partial_credit_policy": "允许 partial credit：每条 0/1/2。操作类 criterion 若进入正确位置但未完成该步得 1；说明类方向正确但未说明依据得 1。不因结果美观程度或效果好坏扣分。",
  "allowed_support": ["lesson notes", "course outline", "product UI"],
  "disallowed_support": ["external web search", "unverified community tutorial", "another person's completed answer"],
  "feedback_boundary": "评分后只可告知：哪条 criterion 未达标、对应 Lesson（JCA-M08-L03）、以及「界面数值 ≠ 模型上限」「未验证 ≠ 不支持」两条 boundary 提醒。不对作品美学给出评分性意见，不推断长期掌握程度。",
  "alignment": {
    "completion_check_alignment": "DIRECT",
    "rationale": "JCA-M08-L03 的 completion_check 是「能独立完成一次视频创作（目标 → 提示词 → 触发 → 参考素材 → 下载），能说明其提示词的组织依据与所用参考素材的用途」。C1 ～ C4 对应流程各段，C5 对应说明部分。"
  },
  "limitations": "只覆盖该产品页流程与 2026-10-04 观察界面；不含按钮位置、耗时、队列、失败重试、素材规格、分项数量条件与效果承诺；不证明所有账号/地区/客户端一致；不评分美学质量；一次评估不代表长期掌握。",
  "status": "full_course"
}
