{
  "assessment_id": "JCA-A-006",
  "lesson_ids": ["JCA-M01-L02"],
  "lesson_pair_reason": "NOT_APPLICABLE",
  "assessment_type": "IDENTIFY",
  "purpose": "测量 JCA-M01-L02 的四条 outcome：学生要在未登录创作首页上指认正确位置、说出最小进入路径，并正确区分三类来源不能互相证明。",
  "target_outcomes": [
    "识别 Jimeng Web 创作首页的“创作”区域与“生成”“画布”入口",
    "解释未登录状态下“对话”“画布”显示“请先登录”，并指出“登录”入口位置",
    "区分历史 App 版本记录与当前 Web 观察属于不同客户端范围",
    "解释进入创作区域的最小路径"
  ],
  "knowledge_refs": ["JIM-K-0010", "JIM-K-0029", "JIM-K-0044", "JIM-K-0045", "JIM-K-0054", "JIM-K-0055", "JIM-K-0056"],
  "scope": "Jimeng Web 2026-10-04 观察到的未登录创作首页与最小进入路径；客户端来源限 Web 观察与 iOS 版本历史两条。不含登录后页面结构、iOS/Android 界面路径与权限条件。",
  "task": "在已证实的 Jimeng Web 未登录创作首页上完成四件事：①指出「创作」区域；②指出「生成」与「画布」两个入口；③指出两处「请先登录」提示的位置与「登录」入口；④按顺序写出进入创作区域的最小路径。然后回答两个问题：这条「请先登录」提示能不能证明「未登录时任何功能都不能用」？iOS 版本历史里的 2.3.0 条目能不能用来证明 Web 界面的行为？",
  "expected_evidence": "①四处位置的指认记录（截屏标注或坐标描述）；②手写的最小进入路径；③两个反问的书面回答；④说明 2.3.0 条目页面未显示年份时不得推断年份。",
  "scoring_criteria": [
    {"criterion_id": "A006-C1", "description": "指认「创作」区域与两个入口", "evidence_source": "位置指认记录", "weight": 2, "pass_condition": "创作区域、「生成」、「画布」三处均指认正确"},
    {"criterion_id": "A006-C2", "description": "指认两处未登录提示与登录入口", "evidence_source": "位置指认记录", "weight": 2, "pass_condition": "「对话」与「画布」两处提示均指出，且找到「登录」入口"},
    {"criterion_id": "A006-C3", "description": "写出最小进入路径", "evidence_source": "手写路径", "weight": 2, "pass_condition": "顺序正确且起点为打开官方 Web，终点为主创作输入区"},
    {"criterion_id": "A006-C4", "description": "区分三类来源不能互相证明", "evidence_source": "书面回答", "weight": 2, "pass_condition": "指出 Web 观察与 iOS 版本记录属不同客户端、不能互证；并指出「请先登录」不等于协议的真实身份认证要求"},
    {"criterion_id": "A006-C5", "description": "不推断版本年份、不扩大未登录限制", "evidence_source": "书面回答", "weight": 2, "pass_condition": "未为 2.3.0 推断年份；未把「对话/画布未开放」扩大成「未登录时什么都不能用」"}
  ],
  "max_score": 10,
  "pass_score": 8,
  "partial_credit_policy": "允许 partial credit：指认类 criterion 按 0/1/2 计分——三处中指对两处得 1；路径若顺序正确但起点遗漏得 1。不因表述用词不同扣分。",
  "allowed_support": ["lesson notes", "course outline", "product UI"],
  "disallowed_support": ["external web search", "unverified community tutorial", "another person's completed answer"],
  "feedback_boundary": "评分后只可告知：哪条 criterion 未达标、对应 Lesson（JCA-M01-L02）、以及「请先登录 ≠ 真实身份认证」「不同客户端来源不得互证」这两条 boundary 提醒。不得给出登录后的页面结构或移动端路径。",
  "alignment": {
    "completion_check_alignment": "DIRECT",
    "rationale": "JCA-M01-L02 的 completion_check 是「能在该页面上指出创作区域、两个入口、两处未登录提示与登录入口，说出最小进入路径，并正确说明『请先登录』不等于真实身份认证要求、Web 观察与 iOS 版本记录不能互相证明」。C1/C2 对指认，C3 对路径，C4/C5 对两处说明。"
  },
  "limitations": "只覆盖 2026-10-04 的单次未登录 Web 观察与 App Store 版本历史条目；不含登录后页面结构、移动端路径、会员/积分/价格/权限条件；不推断版本年份；一次评估不代表长期掌握。",
  "status": "full_course"
}
