{
  "assessment_id": "JCA-A-010",
  "lesson_ids": ["JCA-M04-L01"],
  "lesson_pair_reason": "NOT_APPLICABLE",
  "assessment_type": "EXPLAIN_BOUNDARY",
  "purpose": "测量 JCA-M04-L01 的两条 outcome：学生要说明提示词在流程中的位置与它承担的描述作用，并指出四类描述要素。",
  "target_outcomes": ["解释提示词属于流程中的输入步骤", "识别提示词需要描述的主体、动作、镜头与视觉风格"],
  "knowledge_refs": ["JIM-K-0011", "JIM-K-0020"],
  "scope": "Jimeng Product Layer；即梦 Seedance 2.5 产品页对提示词角色与描述要素的说明；不含写作方法。",
  "task": "说明提示词在生成流程中处于哪一步，并写出它承担的描述作用所覆盖的四类要素。然后回答一句：这四类要素能不能直接当作提示词写作公式使用？说明理由。",
  "expected_evidence": "①指出提示词属流程中的输入步骤、与上传素材属同一步骤；②写出四类要素（主体、动作、镜头、视觉风格）；③一句说明它不是写作方法指导，未给出结构、语法与字数规则。",
  "scoring_criteria": [
    {"criterion_id": "A010-C1", "description": "指出提示词属流程中的输入步骤", "evidence_source": "手写说明", "weight": 2, "pass_condition": "写明提示词与上传素材属同一步骤，不是生成之后的调整手段"},
    {"criterion_id": "A010-C2", "description": "写出四类描述要素", "evidence_source": "手写说明", "weight": 2, "pass_condition": "主体、动作、镜头、视觉风格四项齐全"},
    {"criterion_id": "A010-C3", "description": "说明四类要素不是写作公式", "evidence_source": "手写理由", "weight": 2, "pass_condition": "指出它只是角色与要素说明，未给出组织方式、顺序或字数"},
    {"criterion_id": "A010-C4", "description": "不补写未教的写作规则", "evidence_source": "整体作答", "weight": 2, "pass_condition": "未补上结构、语法、字数或示例规则"},
    {"criterion_id": "A010-C5", "description": "不把提示词与素材混为两个独立步骤", "evidence_source": "整体作答", "weight": 2, "pass_condition": "没有任何一处把提示词写成与素材无关的独立步骤"}
  ],
  "max_score": 10,
  "pass_score": 8,
  "partial_credit_policy": "允许 partial credit：每条 0/1/2。四类要素漏一项得 1、漏两项及以上得 0；理由类方向正确但未说明依据得 1。不因用词不同扣分。",
  "allowed_support": ["lesson notes", "course outline"],
  "disallowed_support": ["external web search", "unverified community tutorial", "another person's completed answer"],
  "feedback_boundary": "评分后只可告知：哪条 criterion 未达标、对应 Lesson（JCA-M04-L01）、以及「角色与要素说明 ≠ 写作方法」这一 boundary 提醒。不得补写提示词结构、语法与字数规则。",
  "alignment": {
    "completion_check_alignment": "DIRECT",
    "rationale": "JCA-M04-L01 的 completion_check 是「能说明提示词属于流程的输入环节，并准确说出它描述的四类要素，同时指出这不是写作方法指导」。C1/C2 对应前两段，C3/C4/C5 对应最后一段与其边界。"
  },
  "limitations": "只覆盖该产品页对提示词角色与要素的说明；不含结构、语法、字数、示例与完整技法；本课不含界面操作；一次评估不代表长期掌握。",
  "status": "full_course"
}
