{
  "assessment_id": "JCA-A-008",
  "lesson_ids": ["JCA-M03-L02"],
  "lesson_pair_reason": "NOT_APPLICABLE",
  "assessment_type": "EXPLAIN_BOUNDARY",
  "purpose": "测量 JCA-M03-L02 的两条 outcome：学生要说明第二步允许的输入类型、提示词的职责，并区分产品层音画协同说明与模型技术细节。",
  "target_outcomes": ["解释第二步允许的输入类型", "解释提示词在该步骤中的职责"],
  "knowledge_refs": ["JIM-K-0011", "JIM-K-0014"],
  "scope": "即梦 Seedance 2.5 公开产品页所述第二步的输入类型与提示词职责；产品层描述。不含提示词写法、素材数值规格与音频上传方式。",
  "task": "写出第二步包含哪两类输入，并说明提示词在该步骤中需要描述的四类要素。然后用一句话说明：产品页「可以生成带声音的视频、并支持音画协同创作」这一说明属于哪一层，以及它不能推出什么。",
  "expected_evidence": "①两类输入（上传素材、输入提示词）及「同一步骤」这一关系；②提示词描述的四类要素（主体、动作、镜头、视觉风格）；③说明音画协同属产品层声明，不等于底层模型技术细节，也不证明存在音频上传入口。",
  "scoring_criteria": [
    {"criterion_id": "A008-C1", "description": "写出第二步的两类输入", "evidence_source": "手写说明", "weight": 2, "pass_condition": "写出「上传素材」与「输入提示词」，并说明二者属同一步骤"},
    {"criterion_id": "A008-C2", "description": "写出提示词描述的四类要素", "evidence_source": "手写说明", "weight": 2, "pass_condition": "主体、动作、镜头、视觉风格四项齐全"},
    {"criterion_id": "A008-C3", "description": "区分音画协同的产品层性质", "evidence_source": "手写说明", "weight": 2, "pass_condition": "指出该说明属产品层，不等于底层模型的音视频联合生成技术细节"},
    {"criterion_id": "A008-C4", "description": "说明音画协同不能推出什么", "evidence_source": "手写说明", "weight": 2, "pass_condition": "指出它不证明存在音频上传入口、不承诺声音与画面一致性、不说明格式与时长"},
    {"criterion_id": "A008-C5", "description": "不把音画协同当作产品承诺", "evidence_source": "整体作答", "weight": 2, "pass_condition": "没有任何一处把「可以生成带声音的视频」写成效果或一致性保证"}
  ],
  "max_score": 10,
  "pass_score": 8,
  "partial_credit_policy": "允许 partial credit：每条 0/1/2。四类要素漏一项得 1、漏两项及以上得 0；说明类抓住要点但表述不完整得 1。不因用词不同扣分。",
  "allowed_support": ["lesson notes", "course outline"],
  "disallowed_support": ["external web search", "unverified community tutorial", "another person's completed answer"],
  "feedback_boundary": "评分后只可告知：哪条 criterion 未达标、对应 Lesson（JCA-M03-L02）、以及「产品层声明 ≠ 模型技术细节」这一 boundary 提醒。不得补充音频上传方式、格式、时长或口型同步精度。",
  "alignment": {
    "completion_check_alignment": "DIRECT",
    "rationale": "JCA-M03-L02 的 completion_check 是「能说明第二步包含『上传素材』与『输入提示词』两条并行输入线，能说出提示词需要描述的四类要素，并能指出音画协同是产品层说明、不证明音频上传方式存在」。C1/C2 与 C3/C4/C5 分别对应这三段。"
  },
  "limitations": "只覆盖该产品页所述第二步；不含提示词写法细节、素材数值规格、音频上传方式与格式；不承诺声音与画面一致性；一次评估不代表长期掌握。",
  "status": "full_course"
}
