{
"assessment_id":"JCA-A-912","lesson_ids":["JCA-M02-L03"],"lesson_pair_reason":"NOT_APPLICABLE",
"assessment_type":"CLASSIFY","purpose":"夹具：status = full_course 生命周期回归。",
"target_outcomes":["区分 Seedream 模型层能力声明与图片产品流程步骤"],
"knowledge_refs":["JIM-K-0004"],
"scope":"夹具 scope。",
"task":"夹具 task。","expected_evidence":"夹具 evidence。",
"scoring_criteria":[{"criterion_id":"FIX-C1","description":"夹具。","evidence_source":"归类结果","weight":2,"pass_condition":"夹具。"}],
"max_score":2,"pass_score":2,"partial_credit_policy":"夹具。",
"allowed_support":["lesson notes"],"disallowed_support":["external web search"],
"feedback_boundary":"夹具。","alignment":{"completion_check_alignment":"DIRECT","rationale":"夹具。"},
"limitations":"夹具。","status":"full_course"
}
