{
  "assessment_id": "JCA-A-017",
  "lesson_ids": ["JCA-M06-L02"],
  "lesson_pair_reason": "NOT_APPLICABLE",
  "assessment_type": "PERFORM_PROCEDURE",
  "purpose": "测量 JCA-M06-L02 的四条 outcome：学生要提交一次图片局部修改、完成复查与交付，并正确表述两处边界。",
  "target_outcomes": ["输入一次针对已有图片的局部修改要求并提交执行", "检查修改结果并完成下载，或选择重新编辑、再次生成", "解释“局部重绘”等只是结果页可见入口，其内部步骤尚未验证", "解释“其他保持不变”是修改要求，不是产品保证"],
  "knowledge_refs": ["JIM-K-0060", "JIM-K-0061"],
  "scope": "2026-10-04 观察到的 Jimeng Web / Seedream 5.0 Pro 图片修改任务的提交、复查与交付，以及结果页可见入口的验证状态。",
  "task": "对一张已有图片提交一次局部修改要求并完成复查与交付。然后交出两句话：一句话说明结果页里「局部重绘」「去画布编辑」等入口文字被验证到什么程度；另一句话改写「其他保持不变」这一表述，使其符合证据。最后指出本证据是否验证了 Seedance 2.5 的视频编辑。",
  "expected_evidence": "①一次实际的修改任务提交记录（加载图片 → 写明要求 → 提交 → 生成结果）；②一次结果复查与一次下载产物（或选择重新编辑/再次生成）；③一句说明这些子工具只是结果页可见入口、内部步骤未验证（不是不支持）；④一句把「其他保持不变」表述为用户提出的修改目标；⑤一句说明本证据未验证 Seedance 2.5 视频编辑。",
  "scoring_criteria": [
    {"criterion_id": "A017-C1", "description": "提交一次局部修改要求", "evidence_source": "操作记录", "weight": 2, "pass_condition": "存在一次针对已有图片的修改要求提交，且顺序为加载图片 → 写明要求 → 提交"},
    {"criterion_id": "A017-C2", "description": "完成复查与交付", "evidence_source": "下载产物或后续操作", "weight": 2, "pass_condition": "存在一次下载产物，或一次重新编辑／再次生成的选择记录"},
    {"criterion_id": "A017-C3", "description": "说明子工具入口的验证程度", "evidence_source": "手写说明", "weight": 2, "pass_condition": "写为结果页可见入口、内部步骤未验证，且明确不等于不支持"},
    {"criterion_id": "A017-C4", "description": "改写「其他保持不变」", "evidence_source": "改写文本", "weight": 2, "pass_condition": "改写后表述为用户提出的修改目标，而非产品保证"},
    {"criterion_id": "A017-C5", "description": "说明视频编辑未被验证", "evidence_source": "手写说明", "weight": 2, "pass_condition": "指出本证据没有验证 Seedance 2.5 的视频编辑"}
  ],
  "max_score": 10,
  "pass_score": 8,
  "partial_credit_policy": "允许 partial credit：每条 0/1/2。操作类 criterion 若进入正确位置但未完成提交得 1；说明类抓住要点但未区分「未验证」与「不支持」得 1。不因用词不同扣分。",
  "allowed_support": ["lesson notes", "course outline", "product UI"],
  "disallowed_support": ["external web search", "unverified community tutorial", "another person's completed answer"],
  "feedback_boundary": "评分后只可告知：哪条 criterion 未达标、对应 Lesson（JCA-M06-L02）、以及「未验证 ≠ 不支持」「用户修改目标 ≠ 产品保证」两条 boundary 提醒。不得补充子工具内部步骤、文件选择器步骤与素材规格。",
  "alignment": {
    "completion_check_alignment": "DIRECT",
    "rationale": "JCA-M06-L02 的 completion_check 是「能按顺序完成一次图片修改任务并交付，说明『其他保持不变』是用户目标，并说明结果页子工具入口处于『未验证』状态」。C1/C2 对任务与交付，C3/C4/C5 对三处边界表述。"
  },
  "limitations": "scope 限 Jimeng Web、限 2026-10-04 截图时点、限 Seedream 5.0 Pro 图片链路；本证据未验证 Seedance 2.5 视频编辑；不含系统文件选择器步骤、素材格式/大小/时长条件、提交后必然性与耗时/额度/权限信息；子工具内部步骤未验证；不表示所有账号／地区／版本界面一致；一次评估不代表长期掌握。",
  "status": "full_course"
}
