{
  "assessment_id": "JCA-A-014",
  "lesson_ids": ["JCA-M05-L02"],
  "lesson_pair_reason": "NOT_APPLICABLE",
  "assessment_type": "PERFORM_PROCEDURE",
  "purpose": "测量 JCA-M05-L02 的三条 outcome：学生要走通参考内容的加入路径、解释界面总量提示的性质，并说明当前界面的多元素组合与 @ 引用方式。",
  "target_outcomes": ["解释“全能参考”下“参考内容”的加入路径", "解释界面显示的参考素材总量提示，并说明它不是分类型上限", "解释当前界面涉及的图、文、音、视频多元素组合与 @ 引用方式"],
  "knowledge_refs": ["JIM-K-0057", "JIM-K-0058", "JIM-K-0059", "JIM-K-0011", "JIM-K-0014"],
  "scope": "2026-10-04 观察到的 Jimeng Web 视频生成 / Seedance 2.5 / 全能参考界面中的加入路径、总量提示与引用方式。",
  "task": "在已证实的界面上按顺序写出加入参考内容的路径，并完成一次参考素材加入或一次 @ 引用。然后回答两个问题：「上传最多50个参考素材」指的是什么范围？当前界面支持的 @ 引用包含哪几类？",
  "expected_evidence": "①路径（进入生成 → 选择视频生成 → 选择即梦 Seedance 2.5 → 选择全能参考 → 在参考内容处上传，或在输入中用 @ 引用）；②一次实际加入或 @ 引用的记录；③回答 50 是当前界面的总量提示、不是分类型上限也不是模型层上限；④@引用包含图片、视频、音频三类。",
  "scoring_criteria": [
    {"criterion_id": "A014-C1", "description": "写出参考内容的加入路径", "evidence_source": "手写路径", "weight": 2, "pass_condition": "四步顺序正确，且写出「上传」或在输入中用 @ 引用两种加入方式之一"},
    {"criterion_id": "A014-C2", "description": "完成一次加入或 @ 引用", "evidence_source": "屏幕记录或操作结果", "weight": 2, "pass_condition": "存在一次实际的参考素材加入或 @ 引用"},
    {"criterion_id": "A014-C3", "description": "解释「最多50个」的范围", "evidence_source": "书面回答", "weight": 2, "pass_condition": "指出它是当前界面的总量提示，不是图片/视频/音频的分项上限，也不是模型层永久上限"},
    {"criterion_id": "A014-C4", "description": "说明 @ 引用的类别", "evidence_source": "书面回答", "weight": 2, "pass_condition": "写出 @图片1、@视频1、@音频1 三类，并指出 @音频1 对应音色参考"},
    {"criterion_id": "A014-C5", "description": "不把未验证读成不支持", "evidence_source": "书面回答", "weight": 2, "pass_condition": "把独立音频上传路径表述为未单独验证，而不是不支持"}
  ],
  "max_score": 10,
  "pass_score": 8,
  "partial_credit_policy": "允许 partial credit：每条 0/1/2。路径四步中错一步得 1、错两步及以上得 0；回答抓住要点但未说明边界得 1。不因用词不同扣分。",
  "allowed_support": ["lesson notes", "course outline", "product UI"],
  "disallowed_support": ["external web search", "unverified community tutorial", "another person's completed answer"],
  "feedback_boundary": "评分后只可告知：哪条 criterion 未达标、对应 Lesson（JCA-M05-L02）、以及「界面数值 ≠ 模型上限」「未单独验证 ≠ 不支持」两条 boundary 提醒。不得补充素材格式、大小、时长与超限行为。",
  "alignment": {
    "completion_check_alignment": "DIRECT",
    "rationale": "JCA-M05-L02 的 completion_check 是「能说出加入参考内容的路径、解释 50 是界面总量提示而非分项上限或模型上限，并正确说明独立音频上传入口处于『未单独验证』而不是『不支持』」。C1/C2 对路径与操作，C3/C4/C5 对三处边界说明。"
  },
  "limitations": "只覆盖 2026-10-04 的单次已登录界面观察与产品页说明；不含文件选择器步骤、素材格式/大小/时长/分项数量条件、积分会员价格权限、超出上限后的行为与计数方式；不证明其它版本或账号界面一致；一次评估不代表长期掌握。",
  "status": "full_course"
}
