{
  "assessment_id": "JCA-A-007",
  "lesson_ids": ["JCA-M03-L01"],
  "lesson_pair_reason": "NOT_APPLICABLE",
  "assessment_type": "EXPLAIN_BOUNDARY",
  "purpose": "测量 JCA-M03-L01 的两条 outcome：学生要说出视频生成三步流程与产物，并说明第一步的职责与其未说明之处。",
  "target_outcomes": ["解释视频生成三步流程及产物", "解释第一步的职责"],
  "knowledge_refs": ["JIM-K-0009", "JIM-K-0010", "JIM-K-0012", "JIM-K-0024"],
  "scope": "即梦 Seedance 2.5 公开产品页所述流程结构与第一步职责，以及 2026-10-04 观察到的视频生成界面。不含按钮位置、耗时、队列与失败重试规则。",
  "task": "按顺序写出视频生成的三步结构，并指出该流程的产物。然后说明第一步包含哪两个动作、以及该步的哪一点在现有证据中未被说明。最后指出两种基础输入方式的名称，并各举一个你会用它的理由。",
  "expected_evidence": "①三步结构（打开 AI 视频生成器 → 上传素材并输入提示词 → 生成预览并保存）；②产物为可下载的 AI 视频；③第一步的两个动作（进入工具、选择模型）；④指出「是否为默认模型」未被说明；⑤两种基础输入方式（文字提示词、图片视觉参考）及使用理由。",
  "scoring_criteria": [
    {"criterion_id": "A007-C1", "description": "按顺序写出三步结构", "evidence_source": "手写流程", "weight": 2, "pass_condition": "三步名称与顺序均正确"},
    {"criterion_id": "A007-C2", "description": "指出流程产物", "evidence_source": "手写说明", "weight": 2, "pass_condition": "写明产物为可下载的 AI 视频，未扩大为画质或时长保证"},
    {"criterion_id": "A007-C3", "description": "说明第一步的两个动作", "evidence_source": "手写说明", "weight": 2, "pass_condition": "写出「进入即梦的 AI 视频工具」与「选择 Seedance 2.5 模型」"},
    {"criterion_id": "A007-C4", "description": "指出第一步未被说明之处", "evidence_source": "手写说明", "weight": 2, "pass_condition": "指出证据未说明 Seedance 2.5 是否为该工具的默认模型"},
    {"criterion_id": "A007-C5", "description": "区分两种基础输入方式", "evidence_source": "手写说明", "weight": 2, "pass_condition": "写出文字提示词与图片视觉参考两种方式，且未把它们当作同一步骤的两个阶段"}
  ],
  "max_score": 10,
  "pass_score": 8,
  "partial_credit_policy": "允许 partial credit：每条 0/1/2。流程顺序正确但漏一步得 1；动作说明抓住要点但表述不完整得 1。不因用词与产品页不同扣分。",
  "allowed_support": ["lesson notes", "course outline"],
  "disallowed_support": ["external web search", "unverified community tutorial", "another person's completed answer"],
  "feedback_boundary": "评分后只可告知：哪条 criterion 未达标、对应 Lesson（JCA-M03-L01）、以及「产品页流程 ≠ 界面按钮位置」「证据未说明 ≠ 不支持」两条 boundary 提醒。不得补充按钮位置、耗时或队列规则。",
  "alignment": {
    "completion_check_alignment": "DIRECT",
    "rationale": "JCA-M03-L01 的 completion_check 是「能按顺序说出三步流程并指出产物为可下载的 AI 视频，能说明第一步包含『进入工具』与『选择模型』两个动作，并能指出『是否为默认模型』在证据上未被说明」。C1/C2 对流程与产物，C3/C4 对第一步，C5 对两种基础输入方式。"
  },
  "limitations": "只覆盖该产品页所述流程与该时点界面观察；不含按钮位置、界面布局、耗时、队列、失败重试与效果承诺；不证明所有账号界面一致；一次评估不代表长期掌握。",
  "status": "full_course"
}
