{
  "assessment_id": "JCA-A-021",
  "lesson_ids": ["JCA-M08-L01"],
  "lesson_pair_reason": "NOT_APPLICABLE",
  "assessment_type": "IDENTIFY",
  "purpose": "测量 JCA-M08-L01 的两条 outcome：学生要在未登录创作首页完成准备动作，并写出本次创作目标与预期交付物。",
  "target_outcomes": ["识别创作入口并按需要完成登录准入", "说明本次创作的目标与可交付结果"],
  "knowledge_refs": ["JIM-K-0054", "JIM-K-0055", "JIM-K-0056"],
  "scope": "Jimeng Web 2026-10-04 观察到的创作入口与准入范围，以及本课要求的任务目标设定。",
  "task": "在已证实的界面上完成准备：①指出「创作」区域与「生成」「画布」两个入口；②指出两处「请先登录」提示与「登录」入口；③按需要完成登录准入；④写出一句本次创作目标与预期可交付结果。然后回答：如果别人说「未登录时什么都不能用」，你依据本课证据会怎么纠正他？",
  "expected_evidence": "①创作区域与两个入口的指认记录；②两处未登录提示与登录入口的指认记录；③一次登录准入记录；④一句创作目标与预期交付物；⑤一句纠正，指出该提示只说明「对话」「画布」在未登录状态下不被直接开放。",
  "scoring_criteria": [
    {"criterion_id": "A021-C1", "description": "指认创作入口与两个入口标签", "evidence_source": "位置指认记录", "weight": 2, "pass_condition": "创作区域、「生成」、「画布」三处均指认正确"},
    {"criterion_id": "A021-C2", "description": "完成按需登录准入", "evidence_source": "操作记录", "weight": 2, "pass_condition": "需要使用对话或画布时完成了登录准入，且未把它等同于协议的真实身份认证要求"},
    {"criterion_id": "A021-C3", "description": "写出创作目标与交付物", "evidence_source": "书面目标", "weight": 2, "pass_condition": "目标可判断，且写明预期可交付结果"},
    {"criterion_id": "A021-C4", "description": "纠正扩大化的说法", "evidence_source": "书面回答", "weight": 2, "pass_condition": "指出「请先登录」只说明对话与画布未登录时不直接开放，不能推出其它功能都不能用"},
    {"criterion_id": "A021-C5", "description": "不推断未验证的路径", "evidence_source": "整体作答", "weight": 2, "pass_condition": "未把登录后的具体按钮路径或移动端路径当作已验证步骤"}
  ],
  "max_score": 10,
  "pass_score": 8,
  "partial_credit_policy": "允许 partial credit：每条 0/1/2。指认类三处中指对两处得 1；目标写得笼统但可判断得 1。不因表述用词不同扣分。",
  "allowed_support": ["lesson notes", "course outline", "product UI"],
  "disallowed_support": ["external web search", "unverified community tutorial", "another person's completed answer"],
  "feedback_boundary": "评分后只可告知：哪条 criterion 未达标、对应 Lesson（JCA-M08-L01）、以及「请先登录 ≠ 真实身份认证」「未登录限制不得扩大」两条 boundary 提醒。不得给出登录后的页面结构或移动端路径。",
  "alignment": {
    "completion_check_alignment": "DIRECT",
    "rationale": "JCA-M08-L01 的 completion_check 是「能进入创作区域、按需要完成登录准入，并写出本次创作目标与预期可交付结果」。C1/C2 对应进入与准入，C3 对应目标，C4/C5 对应该课的边界要求。"
  },
  "limitations": "只覆盖 2026-10-04 的单次未登录 Web 观察；不含登录后页面结构、iOS/Android 路径、会员/积分/价格/权限条件；不推断名称永久不变；本课不含创作操作步骤；一次评估不代表长期掌握。",
  "status": "full_course"
}
