{
  "assessment_id": "JCA-A-009",
  "lesson_ids": ["JCA-M03-L03"],
  "lesson_pair_reason": "NOT_APPLICABLE",
  "assessment_type": "EXPLAIN_BOUNDARY",
  "purpose": "测量 JCA-M03-L03 的两条 outcome：学生要说明第三步的生成动作与输出处理、指出产物，并说明为什么不能把这一步拆成四个官方步骤。",
  "target_outcomes": ["解释第三步的生成动作与输出处理", "识别该流程的产物"],
  "knowledge_refs": ["JIM-K-0046"],
  "scope": "即梦 Seedance 2.5 公开产品页所述第三步的动作与结果；产品层描述。不含界面位置、耗时、队列与失败重试规则。",
  "task": "写出第三步包含哪些动作、以及该流程的产物是什么。然后改写下面这句话并说明理由：「第三步分为生成、检查、调整、下载四个官方步骤」。",
  "expected_evidence": "①第三步的三个动作（生成 AI 视频、检查效果并完成必要调整、下载成片）；②产物为可下载成片；③一句改写，说明证据只把第三步作为整体描述、不把它拆成四个独立官方步骤。",
  "scoring_criteria": [
    {"criterion_id": "A009-C1", "description": "写出第三步的动作", "evidence_source": "手写说明", "weight": 2, "pass_condition": "包含生成 AI 视频、检查效果并完成必要调整、下载成片三项"},
    {"criterion_id": "A009-C2", "description": "指出流程产物", "evidence_source": "手写说明", "weight": 2, "pass_condition": "写明产物为可下载的成片，未扩大为画质或时长保证"},
    {"criterion_id": "A009-C3", "description": "改写「四个官方步骤」的说法", "evidence_source": "改写文本", "weight": 2, "pass_condition": "改写后不再把四个动作称为独立官方步骤"},
    {"criterion_id": "A009-C4", "description": "说明改写的理由", "evidence_source": "手写理由", "weight": 2, "pass_condition": "指出当前证据只支持把第三步作为整体描述，不支持更细的内部步骤层级"},
    {"criterion_id": "A009-C5", "description": "不补写耗时或失败处理", "evidence_source": "整体作答", "weight": 2, "pass_condition": "未为第三步补上耗时、队列或失败重试规则"}
  ],
  "max_score": 10,
  "pass_score": 8,
  "partial_credit_policy": "允许 partial credit：每条 0/1/2。动作漏一项得 1、漏两项及以上得 0；改写正确但理由空泛得 1。不因用词不同扣分。",
  "allowed_support": ["lesson notes", "course outline"],
  "disallowed_support": ["external web search", "unverified community tutorial", "another person's completed answer"],
  "feedback_boundary": "评分后只可告知：哪条 criterion 未达标、对应 Lesson（JCA-M03-L03）、以及「步骤整体 ≠ 子步骤清单」这一 boundary 提醒。不得补写界面位置或耗时规则。",
  "alignment": {
    "completion_check_alignment": "DIRECT",
    "rationale": "JCA-M03-L03 的 completion_check 是「能解释第三步的生成、检查调整与下载动作，指出产物为可下载成片，并说明证据不把四个动作当作独立官方步骤」。C1/C2 对动作与产物，C3/C4 对「不拆成四步」这一条，C5 对不补写未说明内容。"
  },
  "limitations": "只覆盖该产品页所述第三步；不含界面位置、操作细节、耗时、队列、失败重试与效果承诺；不证明所有账号界面一致；一次评估不代表长期掌握。",
  "status": "full_course"
}
