{
  "assessment_id": "JCA-A-013",
  "lesson_ids": ["JCA-M05-L01"],
  "lesson_pair_reason": "NOT_APPLICABLE",
  "assessment_type": "CLASSIFY",
  "purpose": "测量 JCA-M05-L01 的三条 outcome：学生要解释参考生视频的特征、区分两种基础输入方式，并识别可组合的素材类型。",
  "target_outcomes": ["解释参考生视频是一种以上传参考视频为特征的生成方式", "区分文字输入与图片视觉参考两种方式", "识别可组合的素材类型"],
  "knowledge_refs": ["JIM-K-0017", "JIM-K-0012", "JIM-K-0013"],
  "scope": "Jimeng Product Layer；即梦 Seedance 2.5 产品页与 FAQ 对参考方式、基础输入方式与多模态素材组合的说明。",
  "task": "用自己的话解释「参考生视频」的特征，并指出它与「上传一张参考图片」的区别。然后给出两个基础输入方式的名称，并列出多模态素材组合可以包含的素材类型。",
  "expected_evidence": "①一句说明参考生视频以上传参考视频为特征、用参考视频传达需遵循的动态细节；②两种基础输入方式（文字提示词、图片视觉参考）；③多模态组合的四类素材（脚本、视频、音频、风格素材）。",
  "scoring_criteria": [
    {"criterion_id": "A013-C1", "description": "解释参考生视频的特征", "evidence_source": "手写说明", "weight": 2, "pass_condition": "指出其以上传参考视频为特征，用于传达需遵循的动态细节"},
    {"criterion_id": "A013-C2", "description": "区分两种基础输入方式", "evidence_source": "手写说明", "weight": 2, "pass_condition": "写出文字提示词与图片视觉参考，且未将多模态组合当作第三种基础方式"},
    {"criterion_id": "A013-C3", "description": "识别可组合的素材类型", "evidence_source": "手写说明", "weight": 2, "pass_condition": "列出脚本、视频、音频、风格素材"},
    {"criterion_id": "A013-C4", "description": "不推导素材规格或优先级", "evidence_source": "整体作答", "weight": 2, "pass_condition": "未补上各素材类型的数量上限、格式、优先级或冲突规则"},
    {"criterion_id": "A013-C5", "description": "不把概念当作产品承诺", "evidence_source": "整体作答", "weight": 2, "pass_condition": "没有任何一处把该概念说明写成效果或可用性保证"}
  ],
  "max_score": 10,
  "pass_score": 8,
  "partial_credit_policy": "允许 partial credit：每条 0/1/2。素材类型漏一项得 1、漏两项及以上得 0；说明类抓住要点但表述不完整得 1。不因用词不同扣分。",
  "allowed_support": ["lesson notes", "course outline"],
  "disallowed_support": ["external web search", "unverified community tutorial", "another person's completed answer"],
  "feedback_boundary": "评分后只可告知：哪条 criterion 未达标、对应 Lesson（JCA-M05-L01）、以及「产品概念说明 ≠ 可用性保证」这一 boundary 提醒。不得补充素材数量上限、格式与优先级规则。",
  "alignment": {
    "completion_check_alignment": "DIRECT",
    "rationale": "JCA-M05-L01 的 completion_check 是「能解释参考生视频以上传参考视频为特征、区分文字与图片两种基础输入方式，并说明多模态素材组合可包含脚本、视频、音频与风格素材」。C1/C2/C3 逐段对应。"
  },
  "limitations": "只覆盖该产品页与 FAQ 的概念与方式说明；不含参考视频上传规格、图片规格、各素材数量上限、格式、优先级与冲突规则；不承诺组合效果；本课不含界面路径；一次评估不代表长期掌握。",
  "status": "full_course"
}
